{
  "version": 2,
  "note": "One module set, shared by every track. A module carries no level: tracks rank it.",
  "areas": [
    { "id": "a-fundamentals", "title": { "en": "Fundamentals", "th": "พื้นฐานการเขียนโปรแกรม" } },
    { "id": "a-searching-sorting", "title": { "en": "Searching & sorting", "th": "การค้นหาและการเรียงลำดับ" } },
    { "id": "a-arrays", "title": { "en": "Arrays & ranges", "th": "อาร์เรย์และช่วงข้อมูล" } },
    { "id": "a-data-structures", "title": { "en": "Data structures", "th": "โครงสร้างข้อมูล" } },
    { "id": "a-recursion-dp", "title": { "en": "Recursion & DP", "th": "การเรียกซ้ำและโปรแกรมพลวัต" } },
    { "id": "a-graphs", "title": { "en": "Graphs", "th": "กราฟ" } },
    { "id": "a-techniques", "title": { "en": "Techniques", "th": "เทคนิค" } },
    { "id": "a-maths", "title": { "en": "Maths", "th": "คณิตศาสตร์" } },
    { "id": "a-strings", "title": { "en": "Strings", "th": "สตริง" } },
    { "id": "a-geometry", "title": { "en": "Geometry", "th": "เรขาคณิต" } },
    { "id": "a-interaction", "title": { "en": "Interaction", "th": "การโต้ตอบ" } }
  ],
  "modules": [
    {
      "id": "m-io",
      "area": "a-fundamentals",
      "title": { "en": "Reading input, writing output", "th": "การอ่านข้อมูลเข้าและแสดงผล" },
      "topics": ["io"],
      "prereqs": []
    },
    {
      "id": "m-complexity",
      "area": "a-fundamentals",
      "title": { "en": "Why some programs are too slow", "th": "ทำไมบางโปรแกรมจึงช้าเกินไป" },
      "topics": ["complexity"],
      "prereqs": ["m-io"]
    },
    {
      "id": "m-simulation",
      "area": "a-fundamentals",
      "title": { "en": "Simulating the statement", "th": "จำลองตามโจทย์" },
      "topics": ["simulation"],
      "prereqs": ["m-io"]
    },
    {
      "id": "m-brute-force",
      "area": "a-fundamentals",
      "title": { "en": "Complete search and when it dies", "th": "ค้นหาครบทุกทางและจุดที่มันพัง" },
      "topics": ["brute-force", "complexity"],
      "prereqs": ["m-complexity", "m-simulation"]
    },
    {
      "id": "m-sorting",
      "area": "a-searching-sorting",
      "title": { "en": "Sorting and sorting by a key", "th": "การเรียงลำดับและการเรียงตามเงื่อนไข" },
      "topics": ["sorting"],
      "prereqs": ["m-brute-force"]
    },
    {
      "id": "m-binary-search",
      "area": "a-searching-sorting",
      "title": { "en": "Binary search on answers", "th": "การค้นหาแบบทวิภาคบนคำตอบ" },
      "topics": ["binary-search", "sorting"],
      "prereqs": ["m-sorting"]
    },
    {
      "id": "m-prefix-sums",
      "area": "a-arrays",
      "title": { "en": "Prefix sums", "th": "ผลรวมสะสม" },
      "topics": ["prefix-sums"],
      "prereqs": ["m-complexity"]
    },
    {
      "id": "m-two-pointers",
      "area": "a-arrays",
      "title": { "en": "Two pointers and sliding windows", "th": "สองตัวชี้และหน้าต่างเลื่อน" },
      "topics": ["two-pointers", "prefix-sums"],
      "prereqs": ["m-prefix-sums", "m-sorting"]
    },
    {
      "id": "m-recursion",
      "area": "a-recursion-dp",
      "title": { "en": "Recursion and backtracking", "th": "การเรียกซ้ำและการย้อนกลับ" },
      "topics": ["recursion", "backtracking"],
      "prereqs": ["m-brute-force"]
    },
    {
      "id": "m-stacks-queues",
      "area": "a-data-structures",
      "title": { "en": "Stacks and queues", "th": "สแตกและคิว" },
      "topics": ["stack", "queue"],
      "prereqs": ["m-recursion"]
    },
    {
      "id": "m-sets-maps-heaps",
      "area": "a-data-structures",
      "title": { "en": "Sets, maps and heaps", "th": "เซต แมป และฮีป" },
      "topics": ["set-map", "heap"],
      "prereqs": ["m-sorting"]
    },
    {
      "id": "m-dsu",
      "area": "a-data-structures",
      "title": { "en": "Disjoint set union", "th": "ยูเนียน-ไฟน์" },
      "topics": ["dsu"],
      "prereqs": ["m-sets-maps-heaps"]
    },
    {
      "id": "m-graph-traversal",
      "area": "a-graphs",
      "title": { "en": "BFS and DFS on graphs and grids", "th": "BFS และ DFS บนกราฟและตาราง" },
      "topics": ["bfs", "dfs", "queue"],
      "prereqs": ["m-stacks-queues"]
    },
    {
      "id": "m-greedy",
      "area": "a-techniques",
      "title": { "en": "Greedy and exchange arguments", "th": "การเลือกแบบละโมบและการแลกเปลี่ยน" },
      "topics": ["greedy", "sorting"],
      "prereqs": ["m-two-pointers"]
    },
    {
      "id": "m-dp-intro",
      "area": "a-recursion-dp",
      "title": { "en": "Dynamic programming from scratch", "th": "โปรแกรมพลวัตตั้งแต่ต้น" },
      "topics": ["dp", "recursion"],
      "prereqs": ["m-recursion"]
    },
    {
      "id": "m-dp-knapsack",
      "area": "a-recursion-dp",
      "title": { "en": "Knapsack and subset DP", "th": "กระเป๋าเป้และซับเซต DP" },
      "topics": ["dp"],
      "prereqs": ["m-dp-intro"]
    },
    {
      "id": "m-dp-bitmask",
      "area": "a-recursion-dp",
      "title": { "en": "Bitmask DP", "th": "โปรแกรมพลวัตด้วยบิตมาสก์" },
      "topics": ["bitmask", "dp"],
      "prereqs": ["m-dp-knapsack"]
    },
    {
      "id": "m-dijkstra",
      "area": "a-graphs",
      "title": { "en": "Dijkstra and shortest paths", "th": "ไดจ์กสตราและเส้นทางสั้นที่สุด" },
      "topics": ["dijkstra", "heap"],
      "prereqs": ["m-graph-traversal", "m-sets-maps-heaps"]
    },
    {
      "id": "m-mst",
      "area": "a-graphs",
      "title": { "en": "Minimum spanning trees", "th": "ต้นไม้แผ่กิ่งก้านน้อยที่สุด" },
      "topics": ["mst", "dsu"],
      "prereqs": ["m-dsu", "m-dijkstra"]
    },
    {
      "id": "m-fenwick",
      "area": "a-data-structures",
      "title": { "en": "Fenwick trees", "th": "ต้นไม้เฟนวิก" },
      "topics": ["fenwick"],
      "prereqs": ["m-prefix-sums"]
    },
    {
      "id": "m-segment-tree",
      "area": "a-data-structures",
      "title": { "en": "Segment trees", "th": "ต้นไม้เซกเมนต์" },
      "topics": ["segment-tree"],
      "prereqs": ["m-fenwick"]
    },
    {
      "id": "m-modular-arithmetic",
      "area": "a-maths",
      "title": { "en": "Modular arithmetic and GCD", "th": "เลขคณิตมอดุลาร์และ ห.ร.ม." },
      "topics": ["modular-arithmetic", "gcd"],
      "prereqs": ["m-complexity"]
    },
    {
      "id": "m-combinatorics",
      "area": "a-maths",
      "title": { "en": "Counting and combinatorics", "th": "การนับและคอมบินาทอริกส์" },
      "topics": ["combinatorics", "modular-arithmetic"],
      "prereqs": ["m-modular-arithmetic", "m-dp-knapsack"]
    },
    {
      "id": "m-offline-queries",
      "area": "a-techniques",
      "title": { "en": "Offline queries and sweeps", "th": "การตอบคำถามออฟไลน์และการกวาด" },
      "topics": ["offline", "segment-tree"],
      "prereqs": ["m-segment-tree"]
    },
    {
      "id": "m-string-hashing",
      "area": "a-strings",
      "title": { "en": "String hashing", "th": "การแฮชสตริง" },
      "topics": ["hashing", "prefix-sums"],
      "prereqs": ["m-prefix-sums"]
    },
    {
      "id": "m-kmp-z",
      "area": "a-strings",
      "title": { "en": "KMP and Z-algorithm", "th": "KMP และ Z-algorithm" },
      "topics": ["kmp", "z-algorithm"],
      "prereqs": ["m-string-hashing"]
    },
    {
      "id": "m-geometry",
      "area": "a-geometry",
      "title": { "en": "Geometry primitives", "th": "พื้นฐานเรขาคณิต" },
      "topics": ["geometry"],
      "prereqs": ["m-binary-search"]
    },
    {
      "id": "m-interactive",
      "area": "a-interaction",
      "title": { "en": "Interactive problems", "th": "โจทย์แบบโต้ตอบ" },
      "topics": ["interactive", "binary-search"],
      "prereqs": ["m-binary-search", "m-graph-traversal"]
    }
  ]
}
